{"$schema": "./schema.json", "instanceId": "droplets.defaults", "theme": {}, "global": {"speed": 1, "delayOffset": 0, "easing": "ease-out-cubic"}, "elements": [], "extras": {"intensity": 0.5, "speed": 1, "scale": 0.4, "dropWidth": 1, "dropLength": 1, "refraction": 0.2, "blur": 0, "vignette": 0, "fallSpeed": 1, "wiggle": 1, "staticDrops": 0.2, "tint": [1, 1, 1], "tintStrength": 0, "fadeInFrames": 0, "fadeOutFrames": 0}}
